{
  "id": "bed-001",
  "sourceType": "generator",
  "source": "blender/assets/bed_001.py",
  "authoringBlender": "5.2.2",
  "frontAxis": "-Y",
  "nominalDimensionsMeters": [1.98, 2.10, 1.52],
  "purpose": "Phase 01A workflow-learning bed; expected to migrate to authored hybrid source",
  "license": {
    "geometry": "Dwelling",
    "externalMaterials": []
  },
  "export": {
    "runtime": "glb"
  }
}
